### ISSUE TITLE
Exim vs. James anomaly

### ISSUE THREAD

**Issue by schongallam** [kenballus/smtp-garden#21]
Unexpected behavior testing Exim sending to James.  Latest commit of Exim (3d13723). Start with sendmsg.py payload to Exim.  Exim relays to James.  James receives message and spools it.  Exim perceives that delivery fails and produces an unexpected DSN notice to the reply-to address (to echo server).

tcpdump shows a good SMTP connection starting off, including James announcing "250-PIPELINING".  Exim does not pipeline MAIL FROM or RCPT TO.  Exim then sends the DATA block, the <CRLF>.<CRLF> sequence, and a QUIT all in the same packet.  Now, the interesting part.  The TCP connection gets closed by Exim, before James sends a "250 Ok".

For comparison: when Exim relays to others, the mail is delivered and no DSN is generated.  Checked against a pipelining server (postfix) and a non-pipeline (opensmtpd).  After DATA, Postfix replies with a "250 Ok ... 221 Bye".  Opensmtpd also replies with a "250".

Looking at the pcaps (I'll email them to you), it looks like in the exim-james conversation, ~~exim send the FIN,ACK.~~ **(correction: James sends FIN,ACK, just like Postfix)**  In the exim-postfix conversation, postfix sends the FIN,ACK.

**Add: see log update, next post**

Exim to James:
```
========= Payload ========

HELO validation.smtp.garden\r\n
MAIL FROM:<validator@validator.smtp.garden>\r\n
RCPT TO:<user1@james.smtp.garden>\r\n
DATA\r\n
MIME-Version: 1.0\r\n
From: "Validator" validator@validator.smtp.garden\r\n
To: "user1" user1@james.smtp.garden\r\n
Date: 2025-04-10 09:29:10.048990\r\n
Subject: Formal validation\r\n
\r\n
Validation message from validator@validator.smtp.garden to user1@james.smtp.garden via exim.\r\n
\r\n
\r\n.\r\n
QUIT\r\n

========= tcpdump ========
15:11:20.303445 IP smtp-garden-exim-1.smtp-garden_smtp.44472 > james.smtp.garden.smtp: Flags [S], seq 235872473, win 64240, options [mss 1460,sackOK,TS val 3328048170 ecr 0,nop,wscale 7,tfo  cookiereq,nop,nop], length 0
	0x0000:  eef7 cdf4 282c 6e8e 96ff cd03 0800 4500  ....(,n.......E.
	0x0010:  0040 6585 4000 4006 7d07 ac13 0003 ac13  .@e.@.@.}.......
	0x0020:  0002 adb8 0019 0e0f 20d9 0000 0000 b002  ................
	0x0030:  faf0 585e 0000 0204 05b4 0402 080a c65d  ..X^...........]
	0x0040:  fc2a 0000 0000 0103 0307 2202 0101       .*........"...
15:11:20.303461 IP james.smtp.garden.smtp > smtp-garden-exim-1.smtp-garden_smtp.44472: Flags [S.], seq 3148042692, ack 235872474, win 65160, options [mss 1460,sackOK,TS val 331689755 ecr 3328048170,nop,wscale 7], length 0
	0x0000:  6e8e 96ff cd03 eef7 cdf4 282c 0800 4500  n.........(,..E.
	0x0010:  003c 0000 4000 4006 e290 ac13 0002 ac13  .<..@.@.........
	0x0020:  0003 0019 adb8 bba3 51c4 0e0f 20da a012  ........Q.......
	0x0030:  fe88 585a 0000 0204 05b4 0402 080a 13c5  ..XZ............
	0x0040:  2f1b c65d fc2a 0103 0307                 /..].*....
15:11:20.303475 IP smtp-garden-exim-1.smtp-garden_smtp.44472 > james.smtp.garden.smtp: Flags [.], ack 1, win 502, options [nop,nop,TS val 3328048170 ecr 331689755], length 0
	0x0000:  eef7 cdf4 282c 6e8e 96ff cd03 0800 4500  ....(,n.......E.
	0x0010:  0034 6586 4000 4006 7d12 ac13 0003 ac13  .4e.@.@.}.......
	0x0020:  0002 adb8 0019 0e0f 20da bba3 51c5 8010  ............Q...
	0x0030:  01f6 5852 0000 0101 080a c65d fc2a 13c5  ..XR.......].*..
	0x0040:  2f1b                                     /.
15:11:20.354216 IP james.smtp.garden.smtp > smtp-garden-exim-1.smtp-garden_smtp.44472: Flags [P.], seq 1:81, ack 1, win 510, options [nop,nop,TS val 331689806 ecr 3328048170], length 80: SMTP: 220 Apache JAMES SMTP Server - james.smtp.garden - SMTP Garden Edition (3.8.1)
	0x0000:  6e8e 96ff cd03 eef7 cdf4 282c 0800 4500  n.........(,..E.
	0x0010:  0084 b568 4000 4006 2ce0 ac13 0002 ac13  ...h@.@.,.......
	0x0020:  0003 0019 adb8 bba3 51c5 0e0f 20da 8018  ........Q.......
	0x0030:  01fe 58a2 0000 0101 080a 13c5 2f4e c65d  ..X........./N.]
	0x0040:  fc2a 3232 3020 4170 6163 6865 204a 414d  .*220.Apache.JAM
	0x0050:  4553 2053 4d54 5020 5365 7276 6572 202d  ES.SMTP.Server.-
	0x0060:  206a 616d 6573 2e73 6d74 702e 6761 7264  .james.smtp.gard
	0x0070:  656e 202d 2053 4d54 5020 4761 7264 656e  en.-.SMTP.Garden
	0x0080:  2045 6469 7469 6f6e 2028 332e 382e 3129  .Edition.(3.8.1)
	0x0090:  0d0a                                     ..
15:11:20.354284 IP smtp-garden-exim-1.smtp-garden_smtp.44472 > james.smtp.garden.smtp: Flags [P.], seq 1:24, ack 81, win 502, options [nop,nop,TS val 3328048221 ecr 331689806], length 23: SMTP: EHLO exim.smtp.garden
	0x0000:  eef7 cdf4 282c 6e8e 96ff cd03 0800 4500  ....(,n.......E.
	0x0010:  004b 6587 4000 4006 7cfa ac13 0003 ac13  .Ke.@.@.|.......
	0x0020:  0002 adb8 0019 0e0f 20da bba3 5215 8018  ............R...
	0x0030:  01f6 5869 0000 0101 080a c65d fc5d 13c5  ..Xi.......].]..
	0x0040:  2f4e 4548 4c4f 2065 7869 6d2e 736d 7470  /NEHLO.exim.smtp
	0x0050:  2e67 6172 6465 6e0d 0a                   .garden..
15:11:20.354293 IP james.smtp.garden.smtp > smtp-garden-exim-1.smtp-garden_smtp.44472: Flags [.], ack 24, win 510, options [nop,nop,TS val 331689806 ecr 3328048221], length 0
	0x0000:  6e8e 96ff cd03 eef7 cdf4 282c 0800 4500  n.........(,..E.
	0x0010:  0034 b569 4000 4006 2d2f ac13 0002 ac13  .4.i@.@.-/......
	0x0020:  0003 0019 adb8 bba3 5215 0e0f 20f1 8010  ........R.......
	0x0030:  01fe 5852 0000 0101 080a 13c5 2f4e c65d  ..XR......../N.]
	0x0040:  fc5d                                     .]
15:11:20.372229 IP james.smtp.garden.smtp > smtp-garden-exim-1.smtp-garden_smtp.44472: Flags [P.], seq 81:196, ack 24, win 510, options [nop,nop,TS val 331689824 ecr 3328048221], length 115: SMTP: 250-james.smtp.garden Hello exim.smtp.garden [172.19.0.3])
	0x0000:  6e8e 96ff cd03 eef7 cdf4 282c 0800 4500  n.........(,..E.
	0x0010:  00a7 b56a 4000 4006 2cbb ac13 0002 ac13  ...j@.@.,.......
	0x0020:  0003 0019 adb8 bba3 5215 0e0f 20f1 8018  ........R.......
	0x0030:  01fe 58c5 0000 0101 080a 13c5 2f60 c65d  ..X........./`.]
	0x0040:  fc5d 3235 302d 6a61 6d65 732e 736d 7470  .]250-james.smtp
	0x0050:  2e67 6172 6465 6e20 4865 6c6c 6f20 6578  .garden.Hello.ex
	0x0060:  696d 2e73 6d74 702e 6761 7264 656e 205b  im.smtp.garden.[
	0x0070:  3137 322e 3139 2e30 2e33 5d29 0d0a 3235  172.19.0.3])..25
	0x0080:  302d 5049 5045 4c49 4e49 4e47 0d0a 3235  0-PIPELINING..25
	0x0090:  302d 454e 4841 4e43 4544 5354 4154 5553  0-ENHANCEDSTATUS
	0x00a0:  434f 4445 530d 0a32 3530 2038 4249 544d  CODES..250.8BITM
	0x00b0:  494d 450d 0a                             IME..
15:11:20.372386 IP smtp-garden-exim-1.smtp-garden_smtp.44472 > james.smtp.garden.smtp: Flags [P.], seq 24:110, ack 196, win 502, options [nop,nop,TS val 3328048239 ecr 331689824], length 86: SMTP: MAIL FROM:<validator@validator.smtp.garden>
	0x0000:  eef7 cdf4 282c 6e8e 96ff cd03 0800 4500  ....(,n.......E.
	0x0010:  008a 6588 4000 4006 7cba ac13 0003 ac13  ..e.@.@.|.......
	0x0020:  0002 adb8 0019 0e0f 20f1 bba3 5288 8018  ............R...
	0x0030:  01f6 58a8 0000 0101 080a c65d fc6f 13c5  ..X........].o..
	0x0040:  2f60 4d41 494c 2046 524f 4d3a 3c76 616c  /`MAIL.FROM:<val
	0x0050:  6964 6174 6f72 4076 616c 6964 6174 6f72  idator@validator
	0x0060:  2e73 6d74 702e 6761 7264 656e 3e0d 0a52  .smtp.garden>..R
	0x0070:  4350 5420 544f 3a3c 7573 6572 3140 6a61  CPT.TO:<user1@ja
	0x0080:  6d65 732e 736d 7470 2e67 6172 6465 6e3e  mes.smtp.garden>
	0x0090:  0d0a 4441 5441 0d0a                      ..DATA..
15:11:20.374488 IP james.smtp.garden.smtp > smtp-garden-exim-1.smtp-garden_smtp.44472: Flags [P.], seq 196:251, ack 110, win 510, options [nop,nop,TS val 331689826 ecr 3328048239], length 55: SMTP: 250 2.1.0 Sender <validator@validator.smtp.garden> OK
	0x0000:  6e8e 96ff cd03 eef7 cdf4 282c 0800 4500  n.........(,..E.
	0x0010:  006b b56b 4000 4006 2cf6 ac13 0002 ac13  .k.k@.@.,.......
	0x0020:  0003 0019 adb8 bba3 5288 0e0f 2147 8018  ........R...!G..
	0x0030:  01fe 5889 0000 0101 080a 13c5 2f62 c65d  ..X........./b.]
	0x0040:  fc6f 3235 3020 322e 312e 3020 5365 6e64  .o250.2.1.0.Send
	0x0050:  6572 203c 7661 6c69 6461 746f 7240 7661  er.<validator@va
	0x0060:  6c69 6461 746f 722e 736d 7470 2e67 6172  lidator.smtp.gar
	0x0070:  6465 6e3e 204f 4b0d 0a                   den>.OK..
15:11:20.378785 IP james.smtp.garden.smtp > smtp-garden-exim-1.smtp-garden_smtp.44472: Flags [P.], seq 251:301, ack 110, win 510, options [nop,nop,TS val 331689831 ecr 3328048239], length 50: SMTP: 250 2.1.5 Recipient <user1@james.smtp.garden> OK
	0x0000:  6e8e 96ff cd03 eef7 cdf4 282c 0800 4500  n.........(,..E.
	0x0010:  0066 b56c 4000 4006 2cfa ac13 0002 ac13  .f.l@.@.,.......
	0x0020:  0003 0019 adb8 bba3 52bf 0e0f 2147 8018  ........R...!G..
	0x0030:  01fe 5884 0000 0101 080a 13c5 2f67 c65d  ..X........./g.]
	0x0040:  fc6f 3235 3020 322e 312e 3520 5265 6369  .o250.2.1.5.Reci
	0x0050:  7069 656e 7420 3c75 7365 7231 406a 616d  pient.<user1@jam
	0x0060:  6573 2e73 6d74 702e 6761 7264 656e 3e20  es.smtp.garden>.
	0x0070:  4f4b 0d0a                                OK..
15:11:20.378809 IP smtp-garden-exim-1.smtp-garden_smtp.44472 > james.smtp.garden.smtp: Flags [.], ack 301, win 502, options [nop,nop,TS val 3328048246 ecr 331689826], length 0
	0x0000:  eef7 cdf4 282c 6e8e 96ff cd03 0800 4500  ....(,n.......E.
	0x0010:  0034 6589 4000 4006 7d0f ac13 0003 ac13  .4e.@.@.}.......
	0x0020:  0002 adb8 0019 0e0f 2147 bba3 52f1 8010  ........!G..R...
	0x0030:  01f6 5852 0000 0101 080a c65d fc76 13c5  ..XR.......].v..
	0x0040:  2f62                                     /b
15:11:20.387189 IP james.smtp.garden.smtp > smtp-garden-exim-1.smtp-garden_smtp.44472: Flags [P.], seq 301:345, ack 110, win 510, options [nop,nop,TS val 331689839 ecr 3328048246], length 44: SMTP: 354 Ok Send data ending with <CRLF>.<CRLF>
	0x0000:  6e8e 96ff cd03 eef7 cdf4 282c 0800 4500  n.........(,..E.
	0x0010:  0060 b56d 4000 4006 2cff ac13 0002 ac13  .`.m@.@.,.......
	0x0020:  0003 0019 adb8 bba3 52f1 0e0f 2147 8018  ........R...!G..
	0x0030:  01fe 587e 0000 0101 080a 13c5 2f6f c65d  ..X~......../o.]
	0x0040:  fc76 3335 3420 4f6b 2053 656e 6420 6461  .v354.Ok.Send.da
	0x0050:  7461 2065 6e64 696e 6720 7769 7468 203c  ta.ending.with.<
	0x0060:  4352 4c46 3e2e 3c43 524c 463e 0d0a       CRLF>.<CRLF>..
15:11:20.387717 IP smtp-garden-exim-1.smtp-garden_smtp.44472 > james.smtp.garden.smtp: Flags [F.], seq 110:651, ack 345, win 502, options [nop,nop,TS val 3328048255 ecr 331689839], length 541: SMTP: Received: from [172.19.0.1] (helo=validation.smtp.garden)
	0x0000:  eef7 cdf4 282c 6e8e 96ff cd03 0800 4500  ....(,n.......E.
	0x0010:  0251 658a 4000 4006 7af1 ac13 0003 ac13  .Qe.@.@.z.......
	0x0020:  0002 adb8 0019 0e0f 2147 bba3 531d 8011  ........!G..S...
	0x0030:  01f6 5a6f 0000 0101 080a c65d fc7f 13c5  ..Zo.......]....
	0x0040:  2f6f 5265 6365 6976 6564 3a20 6672 6f6d  /oReceived:.from
	0x0050:  205b 3137 322e 3139 2e30 2e31 5d20 2868  .[172.19.0.1].(h
	0x0060:  656c 6f3d 7661 6c69 6461 7469 6f6e 2e73  elo=validation.s
	0x0070:  6d74 702e 6761 7264 656e 290d 0a09 6279  mtp.garden)...by
	0x0080:  2065 7869 6d2e 736d 7470 2e67 6172 6465  .exim.smtp.garde
	0x0090:  6e20 7769 7468 2073 6d74 7020 2845 7869  n.with.smtp.(Exi
	0x00a0:  6d20 342e 3938 2d33 3431 2d33 6431 3337  m.4.98-341-3d137
	0x00b0:  3233 3431 290d 0a09 2865 6e76 656c 6f70  2341)...(envelop
	0x00c0:  652d 6672 6f6d 203c 7661 6c69 6461 746f  e-from.<validato
	0x00d0:  7240 7661 6c69 6461 746f 722e 736d 7470  r@validator.smtp
	0x00e0:  2e67 6172 6465 6e3e 290d 0a09 6964 2031  .garden>)...id.1
	0x00f0:  7532 7459 6b2d 3030 3030 3030 3030 3031  u2tYk-0000000001
	0x0100:  312d 3141 3479 0d0a 0966 6f72 2075 7365  1-1A4y...for.use
	0x0110:  7231 406a 616d 6573 2e73 6d74 702e 6761  r1@james.smtp.ga
	0x0120:  7264 656e 3b0d 0a09 5468 752c 2031 3020  rden;...Thu,.10.
	0x0130:  4170 7220 3230 3235 2031 353a 3131 3a32  Apr.2025.15:11:2
	0x0140:  3020 2b30 3030 300d 0a4d 494d 452d 5665  0.+0000..MIME-Ve
	0x0150:  7273 696f 6e3a 2031 2e30 0d0a 4672 6f6d  rsion:.1.0..From
	0x0160:  3a20 2256 616c 6964 6174 6f72 2220 7661  :."Validator".va
	0x0170:  6c69 6461 746f 7240 7661 6c69 6461 746f  lidator@validato
	0x0180:  722e 736d 7470 2e67 6172 6465 6e0d 0a54  r.smtp.garden..T
	0x0190:  6f3a 2022 7573 6572 3122 2075 7365 7231  o:."user1".user1
	0x01a0:  406a 616d 6573 2e73 6d74 702e 6761 7264  @james.smtp.gard
	0x01b0:  656e 0d0a 4461 7465 3a20 3230 3235 2d30  en..Date:.2025-0
	0x01c0:  342d 3130 2030 393a 3239 3a31 302e 3034  4-10.09:29:10.04
	0x01d0:  3839 3930 0d0a 5375 626a 6563 743a 2046  8990..Subject:.F
	0x01e0:  6f72 6d61 6c20 7661 6c69 6461 7469 6f6e  ormal.validation
	0x01f0:  0d0a 0d0a 5661 6c69 6461 7469 6f6e 206d  ....Validation.m
	0x0200:  6573 7361 6765 2066 726f 6d20 7661 6c69  essage.from.vali
	0x0210:  6461 746f 7240 7661 6c69 6461 746f 722e  dator@validator.
	0x0220:  736d 7470 2e67 6172 6465 6e20 746f 2075  smtp.garden.to.u
	0x0230:  7365 7231 406a 616d 6573 2e73 6d74 702e  ser1@james.smtp.
	0x0240:  6761 7264 656e 2076 6961 2065 7869 6d2e  garden.via.exim.
	0x0250:  0d0a 0d0a 0d0a 2e0d 0a51 5549 540d 0a    .........QUIT..
15:11:20.387817 IP james.smtp.garden.smtp > smtp-garden-exim-1.smtp-garden_smtp.44472: Flags [.], ack 652, win 506, options [nop,nop,TS val 331689840 ecr 3328048255], length 0
	0x0000:  6e8e 96ff cd03 eef7 cdf4 282c 0800 4500  n.........(,..E.
	0x0010:  0034 b56e 4000 4006 2d2a ac13 0002 ac13  .4.n@.@.-*......
	0x0020:  0003 0019 adb8 bba3 531d 0e0f 2365 8010  ........S...#e..
	0x0030:  01fa 5852 0000 0101 080a 13c5 2f70 c65d  ..XR......../p.]
	0x0040:  fc7f                                     ..
15:11:20.388173 IP james.smtp.garden.smtp > smtp-garden-exim-1.smtp-garden_smtp.44472: Flags [F.], seq 345, ack 652, win 506, options [nop,nop,TS val 331689840 ecr 3328048255], length 0
	0x0000:  6e8e 96ff cd03 eef7 cdf4 282c 0800 4500  n.........(,..E.
	0x0010:  0034 b56f 4000 4006 2d29 ac13 0002 ac13  .4.o@.@.-)......
	0x0020:  0003 0019 adb8 bba3 531d 0e0f 2365 8011  ........S...#e..
	0x0030:  01fa 5852 0000 0101 080a 13c5 2f70 c65d  ..XR......../p.]
	0x0040:  fc7f                                     ..
15:11:20.388189 IP smtp-garden-exim-1.smtp-garden_smtp.44472 > james.smtp.garden.smtp: Flags [.], ack 346, win 502, options [nop,nop,TS val 3328048255 ecr 331689840], length 0
	0x0000:  eef7 cdf4 282c 6e8e 96ff cd03 0800 4500  ....(,n.......E.
	0x0010:  0034 658b 4000 4006 7d0d ac13 0003 ac13  .4e.@.@.}.......
	0x0020:  0002 adb8 0019 0e0f 2365 bba3 531e 8010  ........#e..S...
	0x0030:  01f6 5852 0000 0101 080a c65d fc7f 13c5  ..XR.......]....
	0x0040:  2f70                                     /p
```

Exim to OpenSMTPD:
```
========= Payload ========

HELO validation.smtp.garden\r\n
MAIL FROM:<validator@validator.smtp.garden>\r\n
RCPT TO:<user1@opensmtpd.smtp.garden>\r\n
DATA\r\n
MIME-Version: 1.0\r\n
From: "Validator" validator@validator.smtp.garden\r\n
To: "user1" user1@opensmtpd.smtp.garden\r\n
Date: 2025-04-10 09:29:10.048990\r\n
Subject: Formal validation\r\n
\r\n
Validation message from validator@validator.smtp.garden to user1@opensmtpd.smtp.garden via exim.\r\n
\r\n
\r\n.\r\n
QUIT\r\n

========= tcpdump ========

15:02:50.205418 IP smtp-garden-exim-1.smtp-garden_smtp.36334 > opensmtpd.smtp.garden.smtp: Flags [S], seq 4148801119, win 64240, options [mss 1460,sackOK,TS val 1173762153 ecr 0,nop,wscale 7,tfo  cookiereq,nop,nop], length 0
	0x0000:  da1f 94c6 645e 6eaa 661b 21e8 0800 4500  ....d^n.f.!...E.
	0x0010:  0040 6ca1 4000 4006 75ea ac13 0004 ac13  .@l.@.@.u.......
	0x0020:  0002 8dee 0019 f749 ae5f 0000 0000 b002  .......I._......
	0x0030:  faf0 585f 0000 0204 05b4 0402 080a 45f6  ..X_..........E.
	0x0040:  3069 0000 0000 0103 0307 2202 0101       0i........"...
15:02:50.205443 IP opensmtpd.smtp.garden.smtp > smtp-garden-exim-1.smtp-garden_smtp.36334: Flags [S.], seq 2612200115, ack 4148801120, win 65160, options [mss 1460,sackOK,TS val 2122517070 ecr 1173762153,nop,wscale 7], length 0
	0x0000:  6eaa 661b 21e8 da1f 94c6 645e 0800 4500  n.f.!.....d^..E.
	0x0010:  003c 0000 4000 4006 e28f ac13 0002 ac13  .<..@.@.........
	0x0020:  0004 0019 8dee 9bb3 02b3 f749 ae60 a012  ...........I.`..
	0x0030:  fe88 585b 0000 0204 05b4 0402 080a 7e83  ..X[..........~.
	0x0040:  0a4e 45f6 3069 0103 0307                 .NE.0i....
15:02:50.205469 IP smtp-garden-exim-1.smtp-garden_smtp.36334 > opensmtpd.smtp.garden.smtp: Flags [.], ack 1, win 502, options [nop,nop,TS val 1173762153 ecr 2122517070], length 0
	0x0000:  da1f 94c6 645e 6eaa 661b 21e8 0800 4500  ....d^n.f.!...E.
	0x0010:  0034 6ca2 4000 4006 75f5 ac13 0004 ac13  .4l.@.@.u.......
	0x0020:  0002 8dee 0019 f749 ae60 9bb3 02b4 8010  .......I.`......
	0x0030:  01f6 5853 0000 0101 080a 45f6 3069 7e83  ..XS......E.0i~.
	0x0040:  0a4e                                     .N
15:02:50.206867 IP opensmtpd.smtp.garden.smtp > smtp-garden-exim-1.smtp-garden_smtp.36334: Flags [P.], seq 1:44, ack 1, win 510, options [nop,nop,TS val 2122517072 ecr 1173762153], length 43: SMTP: 220 smtp-garden-opensmtpd ESMTP OpenSMTPD
	0x0000:  6eaa 661b 21e8 da1f 94c6 645e 0800 4500  n.f.!.....d^..E.
	0x0010:  005f ae73 4000 4006 33f9 ac13 0002 ac13  ._.s@.@.3.......
	0x0020:  0004 0019 8dee 9bb3 02b4 f749 ae60 8018  ...........I.`..
	0x0030:  01fe 587e 0000 0101 080a 7e83 0a50 45f6  ..X~......~..PE.
	0x0040:  3069 3232 3020 736d 7470 2d67 6172 6465  0i220.smtp-garde
	0x0050:  6e2d 6f70 656e 736d 7470 6420 4553 4d54  n-opensmtpd.ESMT
	0x0060:  5020 4f70 656e 534d 5450 440d 0a         P.OpenSMTPD..
15:02:50.206912 IP smtp-garden-exim-1.smtp-garden_smtp.36334 > opensmtpd.smtp.garden.smtp: Flags [P.], seq 1:24, ack 44, win 502, options [nop,nop,TS val 1173762155 ecr 2122517072], length 23: SMTP: EHLO exim.smtp.garden
	0x0000:  da1f 94c6 645e 6eaa 661b 21e8 0800 4500  ....d^n.f.!...E.
	0x0010:  004b 6ca3 4000 4006 75dd ac13 0004 ac13  .Kl.@.@.u.......
	0x0020:  0002 8dee 0019 f749 ae60 9bb3 02df 8018  .......I.`......
	0x0030:  01f6 586a 0000 0101 080a 45f6 306b 7e83  ..Xj......E.0k~.
	0x0040:  0a50 4548 4c4f 2065 7869 6d2e 736d 7470  .PEHLO.exim.smtp
	0x0050:  2e67 6172 6465 6e0d 0a                   .garden..
15:02:50.206919 IP opensmtpd.smtp.garden.smtp > smtp-garden-exim-1.smtp-garden_smtp.36334: Flags [.], ack 24, win 510, options [nop,nop,TS val 2122517072 ecr 1173762155], length 0
	0x0000:  6eaa 661b 21e8 da1f 94c6 645e 0800 4500  n.f.!.....d^..E.
	0x0010:  0034 ae74 4000 4006 3423 ac13 0002 ac13  .4.t@.@.4#......
	0x0020:  0004 0019 8dee 9bb3 02df f749 ae77 8010  ...........I.w..
	0x0030:  01fe 5853 0000 0101 080a 7e83 0a50 45f6  ..XS......~..PE.
	0x0040:  306b                                     0k
15:02:50.207028 IP opensmtpd.smtp.garden.smtp > smtp-garden-exim-1.smtp-garden_smtp.36334: Flags [P.], seq 44:205, ack 24, win 510, options [nop,nop,TS val 2122517072 ecr 1173762155], length 161: SMTP: 250-smtp-garden-opensmtpd Hello exim.smtp.garden [172.19.0.4], pleased to meet you
	0x0000:  6eaa 661b 21e8 da1f 94c6 645e 0800 4500  n.f.!.....d^..E.
	0x0010:  00d5 ae75 4000 4006 3381 ac13 0002 ac13  ...u@.@.3.......
	0x0020:  0004 0019 8dee 9bb3 02df f749 ae77 8018  ...........I.w..
	0x0030:  01fe 58f4 0000 0101 080a 7e83 0a50 45f6  ..X.......~..PE.
	0x0040:  306b 3235 302d 736d 7470 2d67 6172 6465  0k250-smtp-garde
	0x0050:  6e2d 6f70 656e 736d 7470 6420 4865 6c6c  n-opensmtpd.Hell
	0x0060:  6f20 6578 696d 2e73 6d74 702e 6761 7264  o.exim.smtp.gard
	0x0070:  656e 205b 3137 322e 3139 2e30 2e34 5d2c  en.[172.19.0.4],
	0x0080:  2070 6c65 6173 6564 2074 6f20 6d65 6574  .pleased.to.meet
	0x0090:  2079 6f75 0d0a 3235 302d 3842 4954 4d49  .you..250-8BITMI
	0x00a0:  4d45 0d0a 3235 302d 454e 4841 4e43 4544  ME..250-ENHANCED
	0x00b0:  5354 4154 5553 434f 4445 530d 0a32 3530  STATUSCODES..250
	0x00c0:  2d53 495a 4520 3336 3730 3031 3630 0d0a  -SIZE.36700160..
	0x00d0:  3235 302d 4453 4e0d 0a32 3530 2048 454c  250-DSN..250.HEL
	0x00e0:  500d 0a                                  P..
15:02:50.207150 IP smtp-garden-exim-1.smtp-garden_smtp.36334 > opensmtpd.smtp.garden.smtp: Flags [P.], seq 24:79, ack 205, win 501, options [nop,nop,TS val 1173762155 ecr 2122517072], length 55: SMTP: MAIL FROM:<validator@validator.smtp.garden> SIZE=1567
	0x0000:  da1f 94c6 645e 6eaa 661b 21e8 0800 4500  ....d^n.f.!...E.
	0x0010:  006b 6ca4 4000 4006 75bc ac13 0004 ac13  .kl.@.@.u.......
	0x0020:  0002 8dee 0019 f749 ae77 9bb3 0380 8018  .......I.w......
	0x0030:  01f5 588a 0000 0101 080a 45f6 306b 7e83  ..X.......E.0k~.
	0x0040:  0a50 4d41 494c 2046 524f 4d3a 3c76 616c  .PMAIL.FROM:<val
	0x0050:  6964 6174 6f72 4076 616c 6964 6174 6f72  idator@validator
	0x0060:  2e73 6d74 702e 6761 7264 656e 3e20 5349  .smtp.garden>.SI
	0x0070:  5a45 3d31 3536 370d 0a                   ZE=1567..
15:02:50.207588 IP opensmtpd.smtp.garden.smtp > smtp-garden-exim-1.smtp-garden_smtp.36334: Flags [P.], seq 205:219, ack 79, win 510, options [nop,nop,TS val 2122517072 ecr 1173762155], length 14: SMTP: 250 2.0.0 Ok
	0x0000:  6eaa 661b 21e8 da1f 94c6 645e 0800 4500  n.f.!.....d^..E.
	0x0010:  0042 ae76 4000 4006 3413 ac13 0002 ac13  .B.v@.@.4.......
	0x0020:  0004 0019 8dee 9bb3 0380 f749 aeae 8018  ...........I....
	0x0030:  01fe 5861 0000 0101 080a 7e83 0a50 45f6  ..Xa......~..PE.
	0x0040:  306b 3235 3020 322e 302e 3020 4f6b 0d0a  0k250.2.0.0.Ok..
15:02:50.207615 IP smtp-garden-exim-1.smtp-garden_smtp.36334 > opensmtpd.smtp.garden.smtp: Flags [P.], seq 79:118, ack 219, win 501, options [nop,nop,TS val 1173762155 ecr 2122517072], length 39: SMTP: RCPT TO:<user1@opensmtpd.smtp.garden>
	0x0000:  da1f 94c6 645e 6eaa 661b 21e8 0800 4500  ....d^n.f.!...E.
	0x0010:  005b 6ca5 4000 4006 75cb ac13 0004 ac13  .[l.@.@.u.......
	0x0020:  0002 8dee 0019 f749 aeae 9bb3 038e 8018  .......I........
	0x0030:  01f5 587a 0000 0101 080a 45f6 306b 7e83  ..Xz......E.0k~.
	0x0040:  0a50 5243 5054 2054 4f3a 3c75 7365 7231  .PRCPT.TO:<user1
	0x0050:  406f 7065 6e73 6d74 7064 2e73 6d74 702e  @opensmtpd.smtp.
	0x0060:  6761 7264 656e 3e0d 0a                   garden>..
15:02:50.208786 IP opensmtpd.smtp.garden.smtp > smtp-garden-exim-1.smtp-garden_smtp.36334: Flags [P.], seq 219:270, ack 118, win 510, options [nop,nop,TS val 2122517074 ecr 1173762155], length 51: SMTP: 250 2.1.5 Destination address valid: Recipient ok
	0x0000:  6eaa 661b 21e8 da1f 94c6 645e 0800 4500  n.f.!.....d^..E.
	0x0010:  0067 ae77 4000 4006 33ed ac13 0002 ac13  .g.w@.@.3.......
	0x0020:  0004 0019 8dee 9bb3 038e f749 aed5 8018  ...........I....
	0x0030:  01fe 5886 0000 0101 080a 7e83 0a52 45f6  ..X.......~..RE.
	0x0040:  306b 3235 3020 322e 312e 3520 4465 7374  0k250.2.1.5.Dest
	0x0050:  696e 6174 696f 6e20 6164 6472 6573 7320  ination.address.
	0x0060:  7661 6c69 643a 2052 6563 6970 6965 6e74  valid:.Recipient
	0x0070:  206f 6b0d 0a                             .ok..
15:02:50.208827 IP smtp-garden-exim-1.smtp-garden_smtp.36334 > opensmtpd.smtp.garden.smtp: Flags [P.], seq 118:124, ack 270, win 501, options [nop,nop,TS val 1173762157 ecr 2122517074], length 6: SMTP: DATA
	0x0000:  da1f 94c6 645e 6eaa 661b 21e8 0800 4500  ....d^n.f.!...E.
	0x0010:  003a 6ca6 4000 4006 75eb ac13 0004 ac13  .:l.@.@.u.......
	0x0020:  0002 8dee 0019 f749 aed5 9bb3 03c1 8018  .......I........
	0x0030:  01f5 5859 0000 0101 080a 45f6 306d 7e83  ..XY......E.0m~.
	0x0040:  0a52 4441 5441 0d0a                      .RDATA..
15:02:50.209165 IP opensmtpd.smtp.garden.smtp > smtp-garden-exim-1.smtp-garden_smtp.36334: Flags [P.], seq 270:320, ack 124, win 510, options [nop,nop,TS val 2122517074 ecr 1173762157], length 50: SMTP: 354 Enter mail, end with "." on a line by itself
	0x0000:  6eaa 661b 21e8 da1f 94c6 645e 0800 4500  n.f.!.....d^..E.
	0x0010:  0066 ae78 4000 4006 33ed ac13 0002 ac13  .f.x@.@.3.......
	0x0020:  0004 0019 8dee 9bb3 03c1 f749 aedb 8018  ...........I....
	0x0030:  01fe 5885 0000 0101 080a 7e83 0a52 45f6  ..X.......~..RE.
	0x0040:  306d 3335 3420 456e 7465 7220 6d61 696c  0m354.Enter.mail
	0x0050:  2c20 656e 6420 7769 7468 2022 2e22 206f  ,.end.with.".".o
	0x0060:  6e20 6120 6c69 6e65 2062 7920 6974 7365  n.a.line.by.itse
	0x0070:  6c66 0d0a                                lf..
15:02:50.209256 IP smtp-garden-exim-1.smtp-garden_smtp.36334 > opensmtpd.smtp.garden.smtp: Flags [P.], seq 124:671, ack 320, win 501, options [nop,nop,TS val 1173762157 ecr 2122517074], length 547: SMTP: Received: from [172.19.0.1] (helo=validation.smtp.garden)
	0x0000:  da1f 94c6 645e 6eaa 661b 21e8 0800 4500  ....d^n.f.!...E.
	0x0010:  0257 6ca7 4000 4006 73cd ac13 0004 ac13  .Wl.@.@.s.......
	0x0020:  0002 8dee 0019 f749 aedb 9bb3 03f3 8018  .......I........
	0x0030:  01f5 5a76 0000 0101 080a 45f6 306d 7e83  ..Zv......E.0m~.
	0x0040:  0a52 5265 6365 6976 6564 3a20 6672 6f6d  .RReceived:.from
	0x0050:  205b 3137 322e 3139 2e30 2e31 5d20 2868  .[172.19.0.1].(h
	0x0060:  656c 6f3d 7661 6c69 6461 7469 6f6e 2e73  elo=validation.s
	0x0070:  6d74 702e 6761 7264 656e 290d 0a09 6279  mtp.garden)...by
	0x0080:  2065 7869 6d2e 736d 7470 2e67 6172 6465  .exim.smtp.garde
	0x0090:  6e20 7769 7468 2073 6d74 7020 2845 7869  n.with.smtp.(Exi
	0x00a0:  6d20 342e 3938 2d33 3431 2d33 6431 3337  m.4.98-341-3d137
	0x00b0:  3233 3431 290d 0a09 2865 6e76 656c 6f70  2341)...(envelop
	0x00c0:  652d 6672 6f6d 203c 7661 6c69 6461 746f  e-from.<validato
	0x00d0:  7240 7661 6c69 6461 746f 722e 736d 7470  r@validator.smtp
	0x00e0:  2e67 6172 6465 6e3e 290d 0a09 6964 2031  .garden>)...id.1
	0x00f0:  7532 7451 572d 3030 3030 3030 3030 3041  u2tQW-000000000A
	0x0100:  6c2d 306b 506a 0d0a 0966 6f72 2075 7365  l-0kPj...for.use
	0x0110:  7231 406f 7065 6e73 6d74 7064 2e73 6d74  r1@opensmtpd.smt
	0x0120:  702e 6761 7264 656e 3b0d 0a09 5468 752c  p.garden;...Thu,
	0x0130:  2031 3020 4170 7220 3230 3235 2031 353a  .10.Apr.2025.15:
	0x0140:  3032 3a35 3020 2b30 3030 300d 0a4d 494d  02:50.+0000..MIM
	0x0150:  452d 5665 7273 696f 6e3a 2031 2e30 0d0a  E-Version:.1.0..
	0x0160:  4672 6f6d 3a20 2256 616c 6964 6174 6f72  From:."Validator
	0x0170:  2220 7661 6c69 6461 746f 7240 7661 6c69  ".validator@vali
	0x0180:  6461 746f 722e 736d 7470 2e67 6172 6465  dator.smtp.garde
	0x0190:  6e0d 0a54 6f3a 2022 7573 6572 3122 2075  n..To:."user1".u
	0x01a0:  7365 7231 406f 7065 6e73 6d74 7064 2e73  ser1@opensmtpd.s
	0x01b0:  6d74 702e 6761 7264 656e 0d0a 4461 7465  mtp.garden..Date
	0x01c0:  3a20 3230 3235 2d30 342d 3130 2030 393a  :.2025-04-10.09:
	0x01d0:  3239 3a31 302e 3034 3839 3930 0d0a 5375  29:10.048990..Su
	0x01e0:  626a 6563 743a 2046 6f72 6d61 6c20 7661  bject:.Formal.va
	0x01f0:  6c69 6461 7469 6f6e 0d0a 0d0a 5661 6c69  lidation....Vali
	0x0200:  6461 7469 6f6e 206d 6573 7361 6765 2066  dation.message.f
	0x0210:  726f 6d20 7661 6c69 6461 746f 7240 7661  rom.validator@va
	0x0220:  6c69 6461 746f 722e 736d 7470 2e67 6172  lidator.smtp.gar
	0x0230:  6465 6e20 746f 2075 7365 7231 406f 7065  den.to.user1@ope
	0x0240:  6e73 6d74 7064 2e73 6d74 702e 6761 7264  nsmtpd.smtp.gard
	0x0250:  656e 2076 6961 2065 7869 6d2e 0d0a 0d0a  en.via.exim.....
	0x0260:  0d0a 2e0d 0a                             .....
15:02:50.209947 IP opensmtpd.smtp.garden.smtp > smtp-garden-exim-1.smtp-garden_smtp.36334: Flags [P.], seq 320:370, ack 671, win 506, options [nop,nop,TS val 2122517075 ecr 1173762157], length 50: SMTP: 250 2.0.0 dd29ee3b Message accepted for delivery
	0x0000:  6eaa 661b 21e8 da1f 94c6 645e 0800 4500  n.f.!.....d^..E.
	0x0010:  0066 ae79 4000 4006 33ec ac13 0002 ac13  .f.y@.@.3.......
	0x0020:  0004 0019 8dee 9bb3 03f3 f749 b0fe 8018  ...........I....
	0x0030:  01fa 5885 0000 0101 080a 7e83 0a53 45f6  ..X.......~..SE.
	0x0040:  306d 3235 3020 322e 302e 3020 6464 3239  0m250.2.0.0.dd29
	0x0050:  6565 3362 204d 6573 7361 6765 2061 6363  ee3b.Message.acc
	0x0060:  6570 7465 6420 666f 7220 6465 6c69 7665  epted.for.delive
	0x0070:  7279 0d0a                                ry..
15:02:50.214724 IP smtp-garden-exim-1.smtp-garden_smtp.36334 > opensmtpd.smtp.garden.smtp: Flags [F.], seq 671:677, ack 370, win 501, options [nop,nop,TS val 1173762163 ecr 2122517075], length 6: SMTP: QUIT
	0x0000:  da1f 94c6 645e 6eaa 661b 21e8 0800 4500  ....d^n.f.!...E.
	0x0010:  003a 6ca8 4000 4006 75e9 ac13 0004 ac13  .:l.@.@.u.......
	0x0020:  0002 8dee 0019 f749 b0fe 9bb3 0425 8011  .......I.....%..
	0x0030:  01f5 5859 0000 0101 080a 45f6 3073 7e83  ..XY......E.0s~.
	0x0040:  0a53 5155 4954 0d0a                      .SQUIT..
15:02:50.214828 IP opensmtpd.smtp.garden.smtp > smtp-garden-exim-1.smtp-garden_smtp.36334: Flags [P.], seq 370:385, ack 678, win 506, options [nop,nop,TS val 2122517080 ecr 1173762163], length 15: SMTP: 221 2.0.0 Bye
	0x0000:  6eaa 661b 21e8 da1f 94c6 645e 0800 4500  n.f.!.....d^..E.
	0x0010:  0043 ae7a 4000 4006 340e ac13 0002 ac13  .C.z@.@.4.......
	0x0020:  0004 0019 8dee 9bb3 0425 f749 b105 8018  .........%.I....
	0x0030:  01fa 5862 0000 0101 080a 7e83 0a58 45f6  ..Xb......~..XE.
	0x0040:  3073 3232 3120 322e 302e 3020 4279 650d  0s221.2.0.0.Bye.
	0x0050:  0a                                       .
15:02:50.214881 IP opensmtpd.smtp.garden.smtp > smtp-garden-exim-1.smtp-garden_smtp.36334: Flags [F.], seq 385, ack 678, win 506, options [nop,nop,TS val 2122517080 ecr 1173762163], length 0
	0x0000:  6eaa 661b 21e8 da1f 94c6 645e 0800 4500  n.f.!.....d^..E.
	0x0010:  0034 ae7b 4000 4006 341c ac13 0002 ac13  .4.{@.@.4.......
	0x0020:  0004 0019 8dee 9bb3 0434 f749 b105 8011  .........4.I....
	0x0030:  01fa 5853 0000 0101 080a 7e83 0a58 45f6  ..XS......~..XE.
	0x0040:  3073                                     0s
15:02:50.214895 IP smtp-garden-exim-1.smtp-garden_smtp.36334 > opensmtpd.smtp.garden.smtp: Flags [.], ack 386, win 501, options [nop,nop,TS val 1173762163 ecr 2122517080], length 0
	0x0000:  da1f 94c6 645e 6eaa 661b 21e8 0800 4500  ....d^n.f.!...E.
	0x0010:  0034 6ca9 4000 4006 75ee ac13 0004 ac13  .4l.@.@.u.......
	0x0020:  0002 8dee 0019 f749 b105 9bb3 0435 8010  .......I.....5..
	0x0030:  01f5 5853 0000 0101 080a 45f6 3073 7e83  ..XS......E.0s~.
	0x0040:  0a58                                     .X
15:02:55.342952 ARP, Request who-has smtp-garden-exim-1.smtp-garden_smtp tell opensmtpd.smtp.garden, length 28
	0x0000:  6eaa 661b 21e8 da1f 94c6 645e 0806 0001  n.f.!.....d^....
	0x0010:  0800 0604 0001 da1f 94c6 645e ac13 0002  ..........d^....
	0x0020:  0000 0000 0000 ac13 0004                 ..........
15:02:55.342989 ARP, Reply smtp-garden-exim-1.smtp-garden_smtp is-at 6e:aa:66:1b:21:e8 (oui Unknown), length 28
	0x0000:  da1f 94c6 645e 6eaa 661b 21e8 0806 0001  ....d^n.f.!.....
	0x0010:  0800 0604 0002 6eaa 661b 21e8 ac13 0004  ......n.f.!.....
	0x0020:  da1f 94c6 645e ac13 0002                 ....d^....

```

Exim to Postfix (non-hex example):
```
========= Payload ========

HELO validation.smtp.garden\r\n
MAIL FROM:<validator@validator.smtp.garden>\r\n
RCPT TO:<user1@postfix.smtp.garden>\r\n
DATA\r\n
MIME-Version: 1.0\r\n
From: "Validator" validator@validator.smtp.garden\r\n
To: "user1" user1@postfix.smtp.garden\r\n
Date: 2025-04-10 09:29:10.048990\r\n
Subject: Formal validation\r\n
\r\n
Validation message from validator@validator.smtp.garden to user1@postfix.smtp.garden via exim.\r\n
\r\n
\r\n.\r\n
QUIT\r\n

========= tcpdump ========

14:18:08.869334 IP postfix.smtp.garden.smtp > smtp-garden-exim-1.smtp-garden_smtp.42758: Flags [P.], seq 1:65, ack 1, win 510, options [nop,nop,TS val 92177822 ecr 1910199568], length 64: SMTP: 220 SMTP Garden postfix container - ESMTP Postfix (Debian/GNU)
E..tM.@.@................V..X.......X......
.~..q.U.220 SMTP Garden postfix container - ESMTP Postfix (Debian/GNU)

14:18:08.869383 IP smtp-garden-exim-1.smtp-garden_smtp.42758 > postfix.smtp.garden.smtp: Flags [P.], seq 1:24, ack 65, win 502, options [nop,nop,TS val 1910199583 ecr 92177822], length 23: SMTP: EHLO exim.smtp.garden
E..K.B@.@..=............X....V......Xk.....
q.U..~..EHLO exim.smtp.garden

14:18:08.869391 IP postfix.smtp.garden.smtp > smtp-garden-exim-1.smtp-garden_smtp.42758: Flags [.], ack 24, win 510, options [nop,nop,TS val 92177822 ecr 1910199583], length 0
E..4M.@.@................V..X..
....XT.....
.~..q.U.
14:18:08.869462 IP postfix.smtp.garden.smtp > smtp-garden-exim-1.smtp-garden_smtp.42758: Flags [P.], seq 65:207, ack 24, win 510, options [nop,nop,TS val 92177822 ecr 1910199583], length 142: SMTP: 250-postfix.smtp.garden
E...M.@.@................V..X..
....X......
.~..q.U.250-postfix.smtp.garden
250-PIPELINING
250-SIZE 10240000
250-VRFY
250-ETRN
250-ENHANCEDSTATUSCODES
250-8BITMIME
250-DSN
250 CHUNKING

14:18:08.869834 IP smtp-garden-exim-1.smtp-garden_smtp.42758 > postfix.smtp.garden.smtp: Flags [F.], seq 24:675, ack 207, win 501, options [nop,nop,TS val 1910199584 ecr 92177822], length 651: SMTP: MAIL FROM:<validator@validator.smtp.garden> SIZE=1561
E....C@.@...............X..
.V......Z......
q.U .~..MAIL FROM:<validator@validator.smtp.garden> SIZE=1561
RCPT TO:<user1@postfix.smtp.garden>
BDAT 538 LAST
Received: from [172.19.0.1] (helo=validation.smtp.garden)
	by exim.smtp.garden with smtp (Exim 4.98-341-3d1372341)
	(envelope-from <validator@validator.smtp.garden>)
	id 1u2sjG-0000000002T-3TI2
	for user1@postfix.smtp.garden;
	Thu, 10 Apr 2025 14:18:08 +0000
MIME-Version: 1.0
From: "Validator" validator@validator.smtp.garden
To: "user1" user1@postfix.smtp.garden
Date: 2025-04-10 09:29:10.048990
Subject: Formal validation

Validation message from validator@validator.smtp.garden to user1@postfix.smtp.garden via exim.


QUIT

14:18:08.869853 IP postfix.smtp.garden.smtp > smtp-garden-exim-1.smtp-garden_smtp.42758: Flags [.], ack 676, win 505, options [nop,nop,TS val 92177823 ecr 1910199584], length 0
E..4M.@.@................V..X.......XT.....
.~..q.U 
14:18:08.889115 IP postfix.smtp.garden.smtp > smtp-garden-exim-1.smtp-garden_smtp.42758: Flags [P.], seq 207:297, ack 676, win 505, options [nop,nop,TS val 92177842 ecr 1910199584], length 90: SMTP: 250 2.1.0 Ok
E...M.@.@................V..X.......X......
.~..q.U 250 2.1.0 Ok
250 2.1.5 Ok
250 2.0.0 Ok: 538 bytes queued as D804E8864F2
221 2.0.0 Bye

14:18:08.889256 IP postfix.smtp.garden.smtp > smtp-garden-exim-1.smtp-garden_smtp.42758: Flags [F.], seq 297, ack 676, win 505, options [nop,nop,TS val 92177842 ecr 1910199584], length 0
E..4M.@.@................V..X.......XT.....
.~..q.U 
14:18:08.889270 IP smtp-garden-exim-1.smtp-garden_smtp.42758 > postfix.smtp.garden.smtp: Flags [.], ack 298, win 501, options [nop,nop,TS val 1910199603 ecr 92177842], length 0
E..4.D@.@..R............X....V......XT.....
q.U3.~..
```
